{
    "accuracy": 100,
    "contest_combos": null,
    "contest_effect": null,
    "contest_type": null,
    "damage_class": {
        "name": "physical",
        "url": "/api/v2/move-damage-class/2/"
    },
    "effect_chance": null,
    "effect_changes": [],
    "effect_entries": [],
    "flavor_text_entries": [
        {
            "flavor_text": "Le lanceur transforme sa col\u00e8re en \u00e9nergie pour attaquer. Plus il a subi d'attaques, plus la puissance de cette capacit\u00e9 augmente.",
            "language": {
                "name": "fr",
                "url": "/api/v2/language/5/"
            },
            "version_group": {
                "name": "scarlet-violet",
                "url": "/api/v2/version-group/25/"
            }
        },
        {
            "flavor_text": "The user converts its rage into energy to attack. The more times the user has been hit by attacks, the greater the move's power.",
            "language": {
                "name": "en",
                "url": "/api/v2/language/9/"
            },
            "version_group": {
                "name": "scarlet-violet",
                "url": "/api/v2/version-group/25/"
            }
        }
    ],
    "generation": {
        "name": "generation-ix",
        "url": "/api/v2/generation/9/"
    },
    "id": 889,
    "learned_by_pokemon": [
        {
            "name": "primeape",
            "url": "/api/v2/pokemon/57/"
        },
        {
            "name": "annihilape",
            "url": "/api/v2/pokemon/979/"
        }
    ],
    "machines": [],
    "meta": null,
    "name": "rage-fist",
    "names": [
        {
            "language": {
                "name": "ja-hrkt",
                "url": "/api/v2/language/1/"
            },
            "name": "\u3075\u3093\u3069\u306e\u3053\u3076\u3057"
        },
        {
            "language": {
                "name": "ko",
                "url": "/api/v2/language/3/"
            },
            "name": "\ubd84\ub178\uc758\uc8fc\uba39"
        },
        {
            "language": {
                "name": "zh-hant",
                "url": "/api/v2/language/4/"
            },
            "name": "\u61a4\u6012\u4e4b\u62f3"
        },
        {
            "language": {
                "name": "fr",
                "url": "/api/v2/language/5/"
            },
            "name": "Poing de Col\u00e8re"
        },
        {
            "language": {
                "name": "de",
                "url": "/api/v2/language/6/"
            },
            "name": "Zornesfaust"
        },
        {
            "language": {
                "name": "it",
                "url": "/api/v2/language/8/"
            },
            "name": "Pugno Furibondo"
        },
        {
            "language": {
                "name": "en",
                "url": "/api/v2/language/9/"
            },
            "name": "Rage Fist"
        },
        {
            "language": {
                "name": "ja",
                "url": "/api/v2/language/11/"
            },
            "name": "\u3075\u3093\u3069\u306e\u3053\u3076\u3057"
        },
        {
            "language": {
                "name": "zh-hans",
                "url": "/api/v2/language/12/"
            },
            "name": "\u6124\u6012\u4e4b\u62f3"
        },
        {
            "language": {
                "name": "es-419",
                "url": "/api/v2/language/14/"
            },
            "name": "Pu\u00f1o Furia"
        },
        {
            "language": {
                "name": "es",
                "url": "/api/v2/language/7/"
            },
            "name": "Pu\u00f1o Furia"
        }
    ],
    "past_values": [],
    "power": 50,
    "pp": 10,
    "priority": 0,
    "stat_changes": [],
    "super_contest_effect": null,
    "target": {
        "name": "selected-pokemon",
        "url": "/api/v2/move-target/10/"
    },
    "type": {
        "name": "ghost",
        "url": "/api/v2/type/8/"
    }
}