{
  "id": 10015,
  "name": "shadow-mist",
  "accuracy": 100,
  "effect_chance": null,
  "pp": null,
  "priority": 0,
  "power": null,
  "contest_combos": null,
  "contest_type": null,
  "contest_effect": null,
  "damage_class": {
    "name": "status",
    "url": "/api/v2/move-damage-class/1/"
  },
  "effect_entries": [
    {
      "effect": "Diminue l'esquive de la cible de deux niveaux.",
      "short_effect": "Diminue l'esquive de la cible de deux niveaux.",
      "language": {
        "name": "fr",
        "url": "/api/v2/language/5/"
      }
    },
    {
      "effect": "Lowers the target’s evasion by two stages.",
      "short_effect": "Lowers the target’s evasion by two stages.",
      "language": {
        "name": "en",
        "url": "/api/v2/language/9/"
      }
    }
  ],
  "effect_changes": [],
  "generation": {
    "name": "generation-iii",
    "url": "/api/v2/generation/3/"
  },
  "meta": null,
  "names": [
    {
      "name": "ダークミスト",
      "language": {
        "name": "ja-hrkt",
        "url": "/api/v2/language/1/"
      }
    },
    {
      "name": "Brume Noire",
      "language": {
        "name": "fr",
        "url": "/api/v2/language/5/"
      }
    },
    {
      "name": "Cryptodunst",
      "language": {
        "name": "de",
        "url": "/api/v2/language/6/"
      }
    },
    {
      "name": "Bruma Oscura",
      "language": {
        "name": "es",
        "url": "/api/v2/language/7/"
      }
    },
    {
      "name": "Nebbiascura",
      "language": {
        "name": "it",
        "url": "/api/v2/language/8/"
      }
    },
    {
      "name": "Shadow Mist",
      "language": {
        "name": "en",
        "url": "/api/v2/language/9/"
      }
    },
    {
      "name": "Bruma Oscura",
      "language": {
        "name": "es-419",
        "url": "/api/v2/language/14/"
      }
    }
  ],
  "past_values": [],
  "stat_changes": [],
  "super_contest_effect": null,
  "target": {
    "name": "opponents-field",
    "url": "/api/v2/move-target/6/"
  },
  "type": {
    "name": "shadow",
    "url": "/api/v2/type/10002/"
  },
  "machines": [],
  "flavor_text_entries": [],
  "learned_by_pokemon": []
}