{
  "id": 748,
  "name": "no-retreat",
  "accuracy": null,
  "effect_chance": 100,
  "pp": 5,
  "priority": 0,
  "power": null,
  "contest_combos": null,
  "contest_type": null,
  "contest_effect": null,
  "damage_class": {
    "name": "status",
    "url": "/api/v2/move-damage-class/1/"
  },
  "effect_entries": [
    {
      "effect": "Prevents user from switching out. Raises all of the user’s stats by one stage. The user or target may switch out using, Baton Pass, Flip turn, Parting Shot, Teleport, U-Turn, or Volt Switch. Fails if the user already has prevented itself from switching by this effect.",
      "short_effect": "Prevents user from switching out. Raises all of the user’s stats by one stage.",
      "language": {
        "name": "en",
        "url": "/api/v2/language/9/"
      }
    }
  ],
  "effect_changes": [],
  "generation": {
    "name": "generation-viii",
    "url": "/api/v2/generation/8/"
  },
  "meta": {
    "ailment": {
      "name": "none",
      "url": "/api/v2/move-ailment/0/"
    },
    "category": {
      "name": "net-good-stats",
      "url": "/api/v2/move-category/2/"
    },
    "min_hits": null,
    "max_hits": null,
    "min_turns": null,
    "max_turns": null,
    "drain": 0,
    "healing": 0,
    "crit_rate": 0,
    "ailment_chance": 0,
    "flinch_chance": 0,
    "stat_chance": 100
  },
  "names": [
    {
      "name": "はいすいのじん",
      "language": {
        "name": "ja-hrkt",
        "url": "/api/v2/language/1/"
      }
    },
    {
      "name": "배수의진",
      "language": {
        "name": "ko",
        "url": "/api/v2/language/3/"
      }
    },
    {
      "name": "背水一戰",
      "language": {
        "name": "zh-hant",
        "url": "/api/v2/language/4/"
      }
    },
    {
      "name": "Ultime Bastion",
      "language": {
        "name": "fr",
        "url": "/api/v2/language/5/"
      }
    },
    {
      "name": "Finalformation",
      "language": {
        "name": "de",
        "url": "/api/v2/language/6/"
      }
    },
    {
      "name": "Bastión Final",
      "language": {
        "name": "es",
        "url": "/api/v2/language/7/"
      }
    },
    {
      "name": "Spalle al Muro",
      "language": {
        "name": "it",
        "url": "/api/v2/language/8/"
      }
    },
    {
      "name": "No Retreat",
      "language": {
        "name": "en",
        "url": "/api/v2/language/9/"
      }
    },
    {
      "name": "はいすいのじん",
      "language": {
        "name": "ja",
        "url": "/api/v2/language/11/"
      }
    },
    {
      "name": "背水一战",
      "language": {
        "name": "zh-hans",
        "url": "/api/v2/language/12/"
      }
    },
    {
      "name": "Bastión Final",
      "language": {
        "name": "es-419",
        "url": "/api/v2/language/14/"
      }
    }
  ],
  "past_values": [],
  "stat_changes": [
    {
      "change": 1,
      "stat": {
        "name": "attack",
        "url": "/api/v2/stat/2/"
      }
    },
    {
      "change": 1,
      "stat": {
        "name": "defense",
        "url": "/api/v2/stat/3/"
      }
    },
    {
      "change": 1,
      "stat": {
        "name": "special-attack",
        "url": "/api/v2/stat/4/"
      }
    },
    {
      "change": 1,
      "stat": {
        "name": "special-defense",
        "url": "/api/v2/stat/5/"
      }
    },
    {
      "change": 1,
      "stat": {
        "name": "speed",
        "url": "/api/v2/stat/6/"
      }
    }
  ],
  "super_contest_effect": null,
  "target": {
    "name": "user",
    "url": "/api/v2/move-target/7/"
  },
  "type": {
    "name": "fighting",
    "url": "/api/v2/type/2/"
  },
  "machines": [],
  "flavor_text_entries": [
    {
      "flavor_text": "じぶんの　すべての\nのうりょくが　あがるが　こうたい　したり\nにげることが　できなくなる。",
      "language": {
        "name": "ja-hrkt",
        "url": "/api/v2/language/1/"
      },
      "version_group": {
        "name": "sword-shield",
        "url": "/api/v2/version-group/20/"
      }
    },
    {
      "flavor_text": "자신의 모든 능력이\n올라가지만 교체하거나\n도망칠 수 없게 된다.",
      "language": {
        "name": "ko",
        "url": "/api/v2/language/3/"
      },
      "version_group": {
        "name": "sword-shield",
        "url": "/api/v2/version-group/20/"
      }
    },
    {
      "flavor_text": "提高自己所有的能力，\n但無法進行替換或逃走。",
      "language": {
        "name": "zh-hant",
        "url": "/api/v2/language/4/"
      },
      "version_group": {
        "name": "sword-shield",
        "url": "/api/v2/version-group/20/"
      }
    },
    {
      "flavor_text": "Le lanceur voit toutes ses stats augmenter,\nmais en contrepartie, il ne peut plus fuir\nou se retirer du combat.",
      "language": {
        "name": "fr",
        "url": "/api/v2/language/5/"
      },
      "version_group": {
        "name": "sword-shield",
        "url": "/api/v2/version-group/20/"
      }
    },
    {
      "flavor_text": "Alle Statuswerte des Anwenders werden erhöht,\naber dafür kann er weder ausgewechselt werden\nnoch fliehen.",
      "language": {
        "name": "de",
        "url": "/api/v2/language/6/"
      },
      "version_group": {
        "name": "sword-shield",
        "url": "/api/v2/version-group/20/"
      }
    },
    {
      "flavor_text": "El usuario aumenta todas sus características, pero ya no\npuede huir ni ser cambiado por otro.",
      "language": {
        "name": "es",
        "url": "/api/v2/language/7/"
      },
      "version_group": {
        "name": "sword-shield",
        "url": "/api/v2/version-group/20/"
      }
    },
    {
      "flavor_text": "Chi la usa aumenta tutte le sue statistiche ma non\npuò più fuggire o essere sostituito.",
      "language": {
        "name": "it",
        "url": "/api/v2/language/8/"
      },
      "version_group": {
        "name": "sword-shield",
        "url": "/api/v2/version-group/20/"
      }
    },
    {
      "flavor_text": "This move raises all the user’s stats but prevents\nthe user from switching out or fleeing.",
      "language": {
        "name": "en",
        "url": "/api/v2/language/9/"
      },
      "version_group": {
        "name": "sword-shield",
        "url": "/api/v2/version-group/20/"
      }
    },
    {
      "flavor_text": "自分の　すべての\n能力が　上がるが　交代　したり\n逃げることが　できなくなる。",
      "language": {
        "name": "ja",
        "url": "/api/v2/language/11/"
      },
      "version_group": {
        "name": "sword-shield",
        "url": "/api/v2/version-group/20/"
      }
    },
    {
      "flavor_text": "提高自己的所有能力，\n但无法替换或逃走。",
      "language": {
        "name": "zh-hans",
        "url": "/api/v2/language/12/"
      },
      "version_group": {
        "name": "sword-shield",
        "url": "/api/v2/version-group/20/"
      }
    },
    {
      "flavor_text": "El usuario aumenta todas sus características, pero ya no\npuede huir ni ser cambiado por otro.",
      "language": {
        "name": "es-419",
        "url": "/api/v2/language/14/"
      },
      "version_group": {
        "name": "sword-shield",
        "url": "/api/v2/version-group/20/"
      }
    },
    {
      "flavor_text": "This move raises all the user's stats but prevents the user from switching out or fleeing.",
      "language": {
        "name": "en",
        "url": "/api/v2/language/9/"
      },
      "version_group": {
        "name": "legends-arceus",
        "url": "/api/v2/version-group/24/"
      }
    },
    {
      "flavor_text": "This move boosts all the user's stats but prevents the user from switching out or fleeing.",
      "language": {
        "name": "en",
        "url": "/api/v2/language/9/"
      },
      "version_group": {
        "name": "scarlet-violet",
        "url": "/api/v2/version-group/25/"
      }
    }
  ],
  "learned_by_pokemon": [
    {
      "name": "falinks",
      "url": "/api/v2/pokemon/870/"
    },
    {
      "name": "falinks-mega",
      "url": "/api/v2/pokemon/10303/"
    }
  ]
}